conversation_id_str,created_at,favorite_count,full_text,id_str,image_url,in_reply_to_screen_name,lang,location,quote_count,reply_count,retweet_count,tweet_url,user_id_str,username,tweet_english
1775638258296430641,Wed Apr 03 22:52:58 +0000 2024,0,wkwkw tp skincare murce banyak bagus kokkkk wardah emina hadalabo omg madame gie hanasui pada baguuss cm pake produk hadalabo marina moist implora wardah alhamdulillah cocokk ngaruhh repurchase gak sampe 250k atas,1775657776557240766,,convomf,in,🍉🍉🍉,0,1,0,https://twitter.com/akalamuca/status/1775657776557240766,1402943082560032774,akalamuca,wkwkw tp skincare murce a lot of good kokkkkkk wardah eminalabo omg madame gie hanasui in baguuss cm using product hadalabo marina moist implora wardah alhamdulillah suitable to affect repurchase not until 250k above
1775409136341266501,Wed Apr 03 22:49:30 +0000 2024,0,bro sharmila dps emina unte pampu mee archives nunchi,1775656901168259127,,Salaar_tz,in,Padagattam,0,0,0,https://twitter.com/quagmire_famgy/status/1775656901168259127,2914945262,quagmire_famgy,Bro Sharmila DPS Emina Unta Pampu Mee Archives Nunchi
1775654295243047318,Wed Apr 03 22:39:08 +0000 2024,0,kampanye 44 mega datang cek tawar hebat nama produk emina sun battle spf 30 pa 60 ml twin pack paket awat sunscreen lindung extra sinar uv,1775654295243047318,https://pbs.twimg.com/media/GKRkHj3a0AAtisa.jpg,,in,Indonesia,0,0,0,https://twitter.com/disc_beauty/status/1775654295243047318,1196575943822737408,disc_beauty,44 mega campaign comes a great bargaining check name Emina Sun Battle SPF 30 PA 60 ml Twin Pack Sunscreen Extra Sinar UV Sunscreen Pack Package
1775535101990015138,Wed Apr 03 22:34:43 +0000 2024,0,gak enak aja gitu kek cair bangettt kamar emang gak berac sih cepet banget leleh banget campur lipbalm bibir kadang aku pake ppp bareng buttered kadang ppp vaseline gentong kadang ppp lipmask emina gak pure si ppp doang,1775653182015942816,,dwomino,in,she | 18,0,0,0,https://twitter.com/dwomino/status/1775653182015942816,1274154134829064192,dwomino,"It's not good, it's really liquid, the room isn't pretty, it's really fast, it's really melting, I really use the lip lip, sometimes I use PPP with butter, sometimes PPP Vaseline Gentong Sometimes PPP Lipmask Emina doesn't pure the PPP only"
1775645087000871399,Wed Apr 03 22:02:33 +0000 2024,0,tobat gue yaallab emina warna lu 3 ngapa shimmer maksud mata gue tabur blink2 kahhhhh,1775645087000871399,https://pbs.twimg.com/media/GKRby8DaQAE0q_C.jpg,,in,wallace,0,0,0,https://twitter.com/burmannii/status/1775645087000871399,1258262888726138880,burmannii,repent me yaallab Emina color you
1775567507539268044,Wed Apr 03 21:50:32 +0000 2024,0,emang gak jijik bagi suami nenek2,1775642065810207067,,8612fan,in,,0,2,0,https://twitter.com/EminaTheCat/status/1775642065810207067,1413755091471921162,EminaTheCat,it's not disgusted for my husband's husband
1775635764996690080,Wed Apr 03 21:25:30 +0000 2024,0,lalu timbang matang putus emina lip mask gt pure paw paw both of them sih moisturizing cuman si emina lbh bagus krn efek lgsg bikin si kulit mati angkat mampu remaja bibir,1775635764996690080,,,in,,0,2,0,https://twitter.com/hwahahanum/status/1775635764996690080,1122469178537963520,hwahahanum,"Then weigh the broken broken Emina Lip Mask Gt Pure Paw Paw Both of them, moisturizing, only the Emina is good because the effect of lgsg makes the dead skin."
1775625981866443178,Wed Apr 03 21:21:49 +0000 2024,0,plis kasih rekomendasi skin type ku tuh oily belum nemu ss cocok gak berat plus minyak udah coba wardah emina skin aqua the originote azarine brand korea warna gold aku lupa merk nya,1775634836201546145,,ohmybeautybank,in,,0,0,0,https://twitter.com/validnodoubt/status/1775634836201546145,1279966704269791232,validnodoubt,"Please give my skin type recommendation, Oily hasn't found SS, it's not heavy plus oil, I tried to wardah Emina Skin Aqua the originote azarine brand korean color gold I forgot the brand"
1775633841228783764,Wed Apr 03 21:17:52 +0000 2024,4,browcara emina ni okay sebab i pandai lukis kening maybe guna benda ni je,1775633841228783764,https://pbs.twimg.com/media/GKRRkIRaEAAZrFJ.jpg,,in,,0,1,1,https://twitter.com/AinRhmn/status/1775633841228783764,1298050467218391041,AinRhmn,Browcara Emina ni okay because I are good at painting forehead may be used
1775495322074300559,Wed Apr 03 21:05:49 +0000 2024,0,mau share brand gede shoppe mall aku curigain kyk hamlin,1775630810063986763,https://pbs.twimg.com/media/GKROz7Sa0AAysj9.jpg,ohmybeautybank,in,,0,0,0,https://twitter.com/EminaTheCat/status/1775630810063986763,1413755091471921162,EminaTheCat,Want to share a brand at Shopee Mall I suspect Kyk Hamlin
1775625147950743709,Wed Apr 03 20:56:29 +0000 2024,0,2 emina water color lip serum produk 1 bikin bibir bener2 lembab hari pigmented banget warna yang bibir gelap jgn khawatir pasti tercover dg sempurna sedia 4 shade favorit mimin dawn 55 rp31500,1775628462516277479,https://pbs.twimg.com/media/GKRMqy7akAA8KkD.jpg,igoshop_wu,in,Indonesia,0,1,0,https://twitter.com/igoshop_wu/status/1775628462516277479,1751945954406850560,igoshop_wu,2 Emina Water Color Lip Serum Product 1 makes lips really moist day pigmented really colors that are dark lips don't worry about it must be covered with perfect 4 favorite shade Mimin Dawn 55 Rp31500
1775389906342400252,Wed Apr 03 20:42:34 +0000 2024,0,kalo murah stainnya mantep cobain emina ini,1775624961069355292,,ohmybeautybank,in,,0,0,0,https://twitter.com/strawberrymoood/status/1775624961069355292,1245368010862362624,strawberrymoood,"if it's cheap, the stain is great, try this emina"
1775613671789707666,Wed Apr 03 19:57:43 +0000 2024,0,habis ngantuk an terbit bisa tidur,1775613671789707666,,,in,,0,0,0,https://twitter.com/EminaTheCat/status/1775613671789707666,1413755091471921162,EminaTheCat,after sleepy and rising can sleep
1775555493651677616,Wed Apr 03 19:33:27 +0000 2024,0,lip mask emina pink lip balm innisfree dewy tint lipbalm vaseline aloe pure paw paw gantung butuh lip scrub biasa diy pake gula madu jarang wkwkwkwk,1775607563968782593,,ohmybeautybank,in,"ind, eng (mostly)",0,0,0,https://twitter.com/wantlino/status/1775607563968782593,1637472877762211840,wantlino,Lip Mask Emina Pink Lip Balm Innisfree Dewy Tint Tint Lipbalm Vaseline Aloe Pure Paw Paw Paw Needs Lip Scrub Ordinary DIY Using Honey Sugar Rarely wkwkwkwk
1775595707065565430,Wed Apr 03 19:31:09 +0000 2024,0,ngapernah coha emina nder coba wardah ajaa buat harga segitu bagus sih trs tahan banting di muka gak cepet ilang punya shade merry mauve,1775606987864117455,,ohmybeautybank,in,ID - SG - SE ,0,0,0,https://twitter.com/skincharediary/status/1775606987864117455,1375426117947940871,skincharediary,"Ngalah Coha Emina Nder just try wardah for the price that is good, but it is resilient in front of not fasting, I have a shade Merry Mauve"
1775595707065565430,Wed Apr 03 18:59:56 +0000 2024,0,akuu suka wardah dlu pake emina tpi suka wardah merry mauveee bagussss,1775599129282113558,,ohmybeautybank,in,,0,0,0,https://twitter.com/moonlightmoney_/status/1775599129282113558,1763991402814504960,moonlightmoney_,I like Wardah used to use Emina but Wardah Merry Mauveee Baguss's face
1775562250868441455,Wed Apr 03 18:34:40 +0000 2024,0,gak merhatiin bkin pink gak enak si tp jujur ak suka laneige tp emina bagusss,1775592773040644148,,ohmybeautybank,in,s/her ,0,0,0,https://twitter.com/morckiegf/status/1775592773040644148,925585042520260608,morckiegf,I didn't pay attention to making pink not tasty but honestly I like Laneige but Emina Bagusss
1775535101990015138,Wed Apr 03 18:20:26 +0000 2024,0,pake tuh bikin bibir cerah aku stop make gak all in one gitu loh gue as lipbalm prepare pake liptint harga mahal sekarang pake lipbalm vaseline emina lip mask gak ampuh ppp nyerahin bibir,1775589189503050103,,ohmybeautybank,in,,0,0,0,https://twitter.com/Taywifeu/status/1775589189503050103,1259730266811236352,Taywifeu,"using it makes my lips bright, stop using all in one, I have lipbalm prepare using a high price liptint now using lipbalm vaseline emina lip mask"
1775518849456361854,Wed Apr 03 17:57:33 +0000 2024,14,tetep curiga sih jari doang aja ipar foto foto wajah,1775583430040055965,,agrlinlv,in,,0,0,1,https://twitter.com/EminaTheCat/status/1775583430040055965,1413755091471921162,EminaTheCat,"Still suspicious of the fingers, just brother -in -law photos"
1775582475223511234,Wed Apr 03 17:53:45 +0000 2024,1,ee shot ki emina peru peditey bagunu,1775582475223511234,,,in,"Rajahmundry, India",0,1,0,https://twitter.com/bondbabuuu/status/1775582475223511234,790914702670958592,bondbabuuu,Ee Shot Ki Emina Peru Peditey Bagunu
1775573715184689196,Wed Apr 03 17:18:56 +0000 2024,0,tweet lewat tl saranin liptint mending merek mana yaa lumayan awet dipake raecca dear me beauty emina mop barenbliss,1775573715184689196,,,in,fast resp? wa ,0,0,0,https://twitter.com/ARUNADUTY/status/1775573715184689196,1325702068905017344,ARUNADUTY,"Tweet via TL suggest that the brand is better, which is pretty durable using Raecca dear me Beauty Emina Mop Barenbliss"
1775562320137314532,Wed Apr 03 17:22:43 +0000 2024,0,3 link sesuai claimnya bikin makeup wet bukan kaya keringetan dewy amp glow finish karna balm lama2 kesan wet looknya ilang harus reapply klo suka mix emina cheeck lit highlighter,1775574666079547839,https://pbs.twimg.com/media/GKQbbcHaoAAJ7J4.jpg,qonitazz,in,,0,1,0,https://twitter.com/qonitazz/status/1775574666079547839,199214139,qonitazz,3 links according to the claim make makeup wet not rich in sweat dewy glow finish because the old balm impression wet look must be reapply if you like to mix emina cheeck lit highlighter
1775136580501721564,Wed Apr 03 17:40:21 +0000 2024,0,kyknya gampang ridho adil adil gak kalo ridho masuk akal kyk aku poligami janda perawan nenek2 bocil ustadzah jablay gak ridho tapi misal poligami taylor swift bella hadid insyaallah ridho,1775579103783199214,,tsbsociety,in,,0,0,0,https://twitter.com/EminaTheCat/status/1775579103783199214,1413755091471921162,EminaTheCat,"I think it's easy to bless it fair if it's bless it makes sense that I am polygamy of the widow of the virgin, the ustadzah jablay is not happy but for example the polygamy of taylor swift bella haj"
1775560101455413465,Wed Apr 03 17:05:21 +0000 2024,0,tangan buntung kok mandiri pake tangan aja,1775570293282742757,,18fesss,in,,0,0,0,https://twitter.com/EminaTheCat/status/1775570293282742757,1413755091471921162,EminaTheCat,"stump hands, how come they are independent using hands"
1775565363620782108,Wed Apr 03 16:45:45 +0000 2024,0,mending beli 1 romand dewyfull water tint 2 emina glossy stain yak wkwkw binguuung,1775565363620782108,,,in,unknown,0,0,0,https://twitter.com/binkatzu/status/1775565363620782108,1263183288815869952,binkatzu,Better Buy 1 Romand Dewyful Water Tint 2 Emina Glossy Stain Yak Wkwkw Binguuung
1769544960695783524,Wed Apr 03 16:12:31 +0000 2024,0,sunscreen emina skin buddy cari murce emina juga kaget pas guardian ditawarin enih kulit sensitif surprisingly emang gak panas gatel texturenya light banget cair gitu tapi perih mata jangan pakai situ,1775557000077934973,https://pbs.twimg.com/media/GKQLrqDbMAAben1.jpg,RukinRiko,in,,0,1,0,https://twitter.com/RukinRiko/status/1775557000077934973,1354059936137793536,RukinRiko,"Sunscreen Emina Skin Buddy looking for Murce Emina is also surprised when the guardian is offered sensitive skin Surprisary is not hot the texture is really liquid, but the eyes don't use it there"
1775555295995162711,Wed Apr 03 16:05:45 +0000 2024,0,admin emina kerja aja yak payment jam 9 malem udah serah kurir gak sampe jam pulang kali etmin istirahaaaat,1775555295995162711,,,in,"East Java, Indonesia",0,0,0,https://twitter.com/ftmhin/status/1775555295995162711,873780341445541889,ftmhin,"Admin Emina just work, not payment at 9 pm already handover of the courier until it comes home etmin istrahaaaaat"
1775535101990015138,Wed Apr 03 16:05:15 +0000 2024,0,bagusss tpi aku gacor emina lip mask,1775555172170940919,,ohmybeautybank,in,,0,0,0,https://twitter.com/skyjroll/status/1775555172170940919,1258052028959322113,skyjroll,good but I'm gacor emina lip mask
1775554181354623331,Wed Apr 03 16:01:19 +0000 2024,0,emina u gak endorse emina makeup ku udah full face emina,1775554181354623331,,,in,,0,0,0,https://twitter.com/agloevera/status/1775554181354623331,943165274,agloevera,Emina u no endorse Emina my makeup is already full face Emina
1775549579733426306,Wed Apr 03 15:43:02 +0000 2024,0,night cream emina susah banget cari sii gue mager aeon ck,1775549579733426306,,,in,,0,1,0,https://twitter.com/gijaraaa/status/1775549579733426306,1542420232526233600,gijaraaa,Night Cream Emina is really hard to find my mager aeon ck
1775535101990015138,Wed Apr 03 15:31:21 +0000 2024,0,makee kalau puasa gin bibir sampe pecah pecah darah nder kalau malam pake kering samsek pernah pakai emina lip mask aku suka ppp bisa hari nggak bikin kering,1775546637131391230,,ohmybeautybank,in,,0,0,0,https://twitter.com/floranrml/status/1775546637131391230,1056087872074276864,floranrml,makee if fasting gin lips until broken blood broken nder if at night wearing dry samsek never use Emina Lip Mask I like PPP can not make it dry the day
1775527464326074487,Wed Apr 03 15:31:00 +0000 2024,0,makan mois hanasui emina,1775546550292533330,,convomf,in,,0,0,0,https://twitter.com/bungalinho000/status/1775546550292533330,1712758647720497152,bungalinho000,Eat Mois Hanasui Emina
1775536262944051369,Wed Apr 03 15:29:42 +0000 2024,0,kalo daily prefer ngalis pakai browcara emina kadang ditambahin pensil alis pinkflash nder kalo special occasion gitu pake pensil alis pinkflash ajaa saran coba pakai brow and lash serum somethinc asap beneran work sih kalo aku,1775546224302788783,,ohmybeautybank,in,Kota Makassar,0,0,0,https://twitter.com/meranqkul/status/1775546224302788783,1451755894044123139,meranqkul,if the daily prefer ngalis uses browcara eminara sometimes added pinkflash eyebrow pencils if special occasion uses pinkflash eyebrow pencil.
1775522557116264932,Wed Apr 03 15:14:26 +0000 2024,1,emina squeeze me up lip glass warna purple tu hehehehe,1775542380248326427,,notawoneh,in,,0,1,0,https://twitter.com/_ladiswasherum_/status/1775542380248326427,1525758619568185344,_ladiswasherum_,Emina Squeeze Me up Lip Glass Purple Color hehehehe
1775537636335407515,Wed Apr 03 15:01:13 +0000 2024,1,oily acne prone lagi pakai bedak emina juga efek tone up nya ada bling nyaa,1775539054295282142,,ohmybeautybank,in,,0,0,0,https://twitter.com/carloey18/status/1775539054295282142,1526817185410142209,carloey18,Oily acne prone again using Emina powder and the tone up effect there is a bling
1775430510384140534,Wed Apr 03 14:48:56 +0000 2024,0,ade pan cbn chesthe guddalu kottukontaru kada ra pacha kukkalu maru cbn emina gudda lo nundi valla money emina ichada vadu tax money ye evaru govt unte vallu icham antaru adi telusuko,1775535964468699160,,Nanibalayya,in,,0,1,0,https://twitter.com/kranthik339/status/1775535964468699160,1510440927739138048,kranthik339,Ade Pan Cbn Chesthe Guddalu Kottukontaru Kada Ra Pacha Kukkalu Maru CBN Emin Gudda Lo Nundi Valla Money Emina Iicada Vadu Tax Money Ye Evaru Govt Unt Unt Vallu Icham Antaru Adi Telusuko
1775531225597591839,Wed Apr 03 14:47:14 +0000 2024,0,emina glossy gitu lupa nama klo diskon 30rban,1775535538919067674,,ohmybeautybank,in,,0,0,0,https://twitter.com/ddudduxoxo/status/1775535538919067674,1598153355368415232,ddudduxoxo,Emina Glossy so forgot the name if a 30rban discount
1775527319538720831,Wed Apr 03 14:33:05 +0000 2024,0,emina abis pake liat banget glowingnya pigeon abis pake gak glowing di muka ringan,1775531976663175324,,bejeweldera,in,,0,0,0,https://twitter.com/persontan/status/1775531976663175324,1260807815985168385,persontan,"Emina after using the pigeon glowing is really glowing after using it, not glowing in a light face"
1775526177740128275,Wed Apr 03 14:16:54 +0000 2024,0,iya tau mbk kan macem lipcream yah nh merek emina yang satu pinkflash lihat,1775527901770997847,,tasiaa26,in,"Lampung, Indonesia",0,0,0,https://twitter.com/Sanpinaa/status/1775527901770997847,1424330292848824322,Sanpinaa,"Yes, you know, it's a pinkflash, the Lipcream Lipcream"
1775513461403144236,Wed Apr 03 14:16:06 +0000 2024,0,orey papam raa e yendaalo ah musali vallani endukuuu ra ila dramalu chepinchi ibbandi pedatharu me rajakiyam kosam vallaki emina ithe ado kuda publicity ki use chesukuntaru kada raa eni sarlu pensions jethalu late ayyai gak appudu evaru raledu emi ilaga this is so cheap,1775527703762149541,,SajjalaBhargava,in,కేశగొర్రె గుండెలో,0,0,0,https://twitter.com/ViswaRakshakudu/status/1775527703762149541,1478778532272631809,ViswaRakshakudu,Orey papam Raa e Yendaalo ah Musali Vallani Enduuu Ra ila Dramalu Chepinchi Ibbandi Pedatharuam Me Rajakiyam Boarding Vallaki Emina ITHE Ado Horse Publicity Ki Use Chesukuntaru Kada Raa Eni Eni Sarlu Jethalu Jethalu Ayyai
1775526441125577159,Wed Apr 03 14:11:05 +0000 2024,0,allah sunscreen emina spf 50 cica bagus bgttt skin prep makeup 8 jam mas bagus bgttt,1775526441125577159,,,in,127,0,1,0,https://twitter.com/beaniemunchkin/status/1775526441125577159,949124971942457345,beaniemunchkin,Allah Sunscreen Emina Spf 50 Cica Bagus Bgttt Skin Prep Makeup 8 Hours Mas Good Bgttt
1775509974590136646,Wed Apr 03 13:58:20 +0000 2024,0,kenal sunscreen juga pake emina blum kenal skincare jdi gak pake moist kusem tpi karna itu lgi bokek cari ganti azzarine bli yang emina eh pas coba sama moist marina gel biru cocok sampe,1775523228683034775,,sooapin,in,s/her ♡ gg enjoyers,0,2,0,https://twitter.com/mystiquegurls/status/1775523228683034775,805219083083870208,mystiquegurls,"Sunscreen also uses Emina yet, I don't know Skincare, so I don't use moist kusem but because it's more Bokek looking for azzarine bli replace"
1775509974590136646,Wed Apr 03 13:50:17 +0000 2024,0,dulu pake sunscreen emina lama bikin kusam banget kaya gak mandi minggu,1775521206042755324,,mystiquegurls,in,"Soo, Ghana",0,2,0,https://twitter.com/sooapin/status/1775521206042755324,1397211768150274052,sooapin,used to use sunscreen Emina for a long time made it very dull like not bathing Sunday
1771456006096105661,Wed Apr 03 13:40:55 +0000 2024,1,telah pakai sunscreen sunscreen yang pakai tuh emina aku gak saran pakai benar okeoke aja dalam tentu wajah kusam pake tapi khawatir ada keluarin sunscreen,1775518848139264301,https://pbs.twimg.com/media/GKPo-7wboAAQZd2.jpg,amazryllis,in,,0,2,0,https://twitter.com/amazryllis/status/1775518848139264301,1758992110391595008,amazryllis,"I have used sunscreen sunscreen that uses Emina, I don't advice, use it right, okay, of course, dull faces use but worried that there is a sunscreen."
1775510303901638747,Wed Apr 03 13:34:50 +0000 2024,1,cb series 2008 cb series 2012 lo kohli redemption natwest 2002 asalu emina matches aa avi audiences raaru ani tisesaru edavalu,1775517315859464219,,ajunttroller,in,,0,1,0,https://twitter.com/VoilentSaint009/status/1775517315859464219,1699391870911062017,VoilentSaint009,CB Series 2008 CB Series 2012 LO Kohli Redemption Natwest 2002 Asalu Emina Matches Aa Avi Audiences Raaru Ani Tisesaru Edavalu
1775171361486631055,Wed Apr 03 13:32:48 +0000 2024,0,liptint dua jeleeek bagus luxcrime gak emina kalo stainnya kenceng,1775516807182622973,,ohmybeautybank,in,,0,0,0,https://twitter.com/wanmoongie/status/1775516807182622973,949999842444566528,wanmoongie,Liptint Two Jeleeek Bagus Luxcrime Not Emina if the stain is fast
1775493747834528249,Wed Apr 03 13:30:42 +0000 2024,0,highlighter kak emina blush on,1775516276414427595,,K124014,in,"Bandung, Indonesia",0,0,0,https://twitter.com/eternalcloud09/status/1775516276414427595,1285362027544711168,eternalcloud09,highlighter sis emina blush on
1775514179551760814,Wed Apr 03 13:22:30 +0000 2024,1,4 feyrelly dew tint pake shade cookie dough grape soda cakep banget stain nya paling bagusss pas udah ubah tinggal tint nya doang tetep rata bibir gak cuman sisa tengah bibir kayak emina gumpal kayak sea makeup liptint underrated,1775514212422623468,https://pbs.twimg.com/media/GKPkw_0bQAAsvrf.jpg,listenupayo,in,Bandung,0,1,0,https://twitter.com/listenupayo/status/1775514212422623468,405449751,listenupayo,"4 Feyrelly Dew Tint Using Shade Cookie Dough grape Soda really handsome, the best stain when I changed the tint, but the lips were not flat, but the remaining lips were lumps like Sea Makeup Underrated Liptint Liptint"
1775514179551760814,Wed Apr 03 13:22:25 +0000 2024,0,2 azarine tinted lippie cake lagi pake shade choco biscuit berry pancake wangi kue lembut emina bikin seulgihalu warna cakep2 sayang stain nya reng kena air langsung hilang,1775514190519902354,https://pbs.twimg.com/media/GKPkvtIbYAAuEtR.jpg,listenupayo,in,Bandung,0,1,0,https://twitter.com/listenupayo/status/1775514190519902354,405449751,listenupayo,"2 azarine tinted lippie cake again using shade choco biscuit berry pancake fragrant cake Emina makes a sulgihalu color cute, unfortunately the stain is rang."
1775514179551760814,Wed Apr 03 13:22:22 +0000 2024,3,kumpul liptint pernah lagi cobain beli pas live mursidah 1 emina glossy stain pernah pake shade 08 pouring tea amp shade 10 choco praline pas dipake lembut amp samar garis bibir lagi kering stain nya awet banget aku,1775514179551760814,https://pbs.twimg.com/media/GKPkvGTbQAASXf5.jpg,,in,Bandung,0,2,0,https://twitter.com/listenupayo/status/1775514179551760814,405449751,listenupayo,Gathering Liptint once again tried to buy when Live Mursidah 1 Emina Glossy STAIN once used shade 08 pouring tea amp shade 10 choco praline when using soft amps faint lip lines again dry stain really durable me
1775505150658089452,Wed Apr 03 13:05:19 +0000 2024,0,gantung mood jujur buat seharihari gua pake lipstick pinkflash shade 03 gak creamy tint emina shade 02,1775509887591846021,,ssefnum,in,Moominvalley,0,0,0,https://twitter.com/istrisuyong/status/1775509887591846021,1638221290065760256,istrisuyong,Hanging honest mood for everyday I use pinkflash shade 03 lipstick not creamy tint Emina shade 02
1775487919035195402,Wed Apr 03 12:50:23 +0000 2024,0,menttt,1775506131688870036,,innerbiebs,in,,0,0,0,https://twitter.com/cicekkokusu23/status/1775506131688870036,1358065940798337025,cicekkokusu23,Menttt
1775506079843291384,Wed Apr 03 12:50:11 +0000 2024,0,ken beli liptint azarine tp ak udh co emina wksjensndbe ak lov emina,1775506079843291384,,,in,MINOR (16),0,0,0,https://twitter.com/jungsuluv/status/1775506079843291384,1469118613722304514,jungsuluv,Ken bought Liptint Azarine but I have Emina Wksjensndbe ak LOV Emina
1775505466325655632,Wed Apr 03 12:47:45 +0000 2024,0,sgt clueless temu cushion setting spray bagus tuk oily skin pls bisikin akloose powder boleh pls ak agk trauma make loose emina,1775505466325655632,,,in,my works ˃ᴗ˂👇🏻,0,3,0,https://twitter.com/jungwonsmochii/status/1775505466325655632,1661727699336065026,jungwonsmochii,SGT Clueless Temu Cushion Setting Spray is good for Oily Skin PLS can make akloose powder may pls ak agk trauma make loose emina
1775494653305057436,Wed Apr 03 12:46:37 +0000 2024,0,emina agent of brow ya biasa pake krn coret langsung liat dibandingin pensil alis viva implora lebih suka honest review krn prnh pepet gara pensil alis eminaku ilang trs coba beli indomrt ada,1775505181201011049,https://pbs.twimg.com/media/GKPci3-awAAe1qV.jpg,piyapiyama,in,,0,0,0,https://twitter.com/piyapiyama/status/1775505181201011049,1751523979268100096,piyapiyama,"Emina Agent of Brow Yes, I used to use it because it was directly caught compared to Viva Implora's eyebrow pencil prefer honest review because it was fast because of the eyebrows of the eyebrows, then try to buy indomrt"
1775494653305057436,Wed Apr 03 12:40:31 +0000 2024,0,coba coba pake eyeshadow pinkflash 02 kalo alis aku biasa pake emina black 01 sorry kalo makeupnya kurang hehhehe,1775503646052225497,https://pbs.twimg.com/media/GKPbJSba0AAqp0H.jpg,piyapiyama,in,,0,0,1,https://twitter.com/piyapiyama/status/1775503646052225497,1751523979268100096,piyapiyama,Try to try using Pinkflash 02 eyeshadow if my eyebrows used to use Emina Black 01 sorry if the makeup is less hehhehe
1775449087514693683,Wed Apr 03 12:29:43 +0000 2024,0,goblok gaji 15jt 30jt pinjol kalo pinter investasi nabung udah masuk bca prioritas,1775500931590971703,,fanabtic,in,,0,1,0,https://twitter.com/EminaTheCat/status/1775500931590971703,1413755091471921162,EminaTheCat,Salary Salary 15 million 30 million loan if smart investment in saving already entered BCA priority
1775465043490111507,Wed Apr 03 12:15:50 +0000 2024,0,msi pke lip lipan emina blum bli cream blush,1775497436938768596,,alphagerl505,in,J.,0,0,0,https://twitter.com/chirumoru/status/1775497436938768596,1755568912467673088,chirumoru,Msi PKE Lipan Emina Blum Blum Bli Cream Blush
1775496774972801475,Wed Apr 03 12:13:12 +0000 2024,5,let s connect with yourself ramadhan connect with yourself mulai skincarean loh emina bright stuff jaga kulit pagi dan maintain kulit malam sharing yuk connect with yourself versi bestie,1775496774972801475,https://pbs.twimg.com/media/GKPU5j7bsAEiqVO.jpg,,in,,0,0,0,https://twitter.com/eminacosmetics/status/1775496774972801475,2934256206,eminacosmetics,Let S Connect with Yourself Ramadhan Connect with Yourself Starting Skincarean Emina Bright Stuff Morning Skin and Maintain Night Skin Sharing Let's Connect With Yourself Version Bestie
1775490008901906477,Wed Apr 03 11:57:11 +0000 2024,0,adaa brand emina wardah,1775492742019465484,,gumygemy,in,read rentry byf!,0,0,0,https://twitter.com/bumplings/status/1775492742019465484,1714610869936803840,bumplings,ADAHA BRAND EMINA WARDAH
1775491898842755320,Wed Apr 03 11:53:50 +0000 2024,0,pake skinaqua tutup putih gak cocok wardah emina type kulit ku oily nyerempet dry skin,1775491898842755320,,,in,backup acc.,0,3,0,https://twitter.com/piswangg/status/1775491898842755320,1736287978455261184,piswangg,using skin aqua white lid does not match wardah emina my skin type oily grazing dry skin
