conversation_id_str,created_at,favorite_count,full_text,id_str,image_url,in_reply_to_screen_name,lang,location,quote_count,reply_count,retweet_count,tweet_url,user_id_str,username,tweet_english
1777202973590094057,Mon Apr 08 05:13:02 +0000 2024,0,jirrr emina liptin doang 45 untung bayarin bokap,1777202973590094057,,,in,"rant, dnf, dnss ",0,0,0,https://twitter.com/celektif/status/1777202973590094057,1725491626112688128,celektif,Jirrr Emina Liptin only 45 Untung Paying Bokapin
1777010950857777361,Mon Apr 08 05:00:31 +0000 2024,0,dong golden tick emina glossy stain ada shade rainy hazelrosenya,1777199823802007755,,discountfess,in,Taiwan,0,1,0,https://twitter.com/pacartono/status/1777199823802007755,1208968497830588416,pacartono,Dong Golden Tick Emina Glossy STAIN There is a Rainy Hazelrosy shade
1777190760133378313,Mon Apr 08 04:55:39 +0000 2024,0,juga pake emina hydraburst emang bagus banget pls,1777198599241335053,,duhapaansi,in,"beauty, outfits and books.",0,0,0,https://twitter.com/favobites/status/1777198599241335053,2277362636,favobites,Also using Emina Hydraburst is really good PLS
1777189325563895973,Mon Apr 08 04:51:21 +0000 2024,0,emina klo,1777197515701645343,,ddeyoongie,in,—2013 ARMY —2020 ENGENE♡OT14,0,0,0,https://twitter.com/runwithsunooo/status/1777197515701645343,1489506594866237440,runwithsunooo,Emina
1777180502262452566,Mon Apr 08 04:19:34 +0000 2024,0,pernah coba emina,1777189517386293531,,journeywithApr,in,,0,0,0,https://twitter.com/Alizaahadi/status/1777189517386293531,1757903833651638272,Alizaahadi,Ever tried Emina
1777189325563895973,Mon Apr 08 04:18:48 +0000 2024,0,mending liptint azarine emina,1777189325563895973,,,in,future's gonna be fucking okay,0,2,0,https://twitter.com/ddeyoongie/status/1777189325563895973,1218101082980675584,ddeyoongie,Better Liptint Azarine Emina
1777152127649153402,Mon Apr 08 03:56:20 +0000 2024,0,madame gie tuh kalau habis wudhu perih banget kek wardah emina pas apply udah perih enak banget tuh gua lupa pokoknga merk jpn malah banget anjir seuprit 150,1777183671843434621,,nanethgabriel,in,,0,1,0,https://twitter.com/justtania13/status/1777183671843434621,1546788764387000321,justtania13,"Madame Gie, if you run out of ablution, it hurts so much that Emina's wardah when applying, it's really good, I forgot the JPN brand, I really really know 150"
1776989460435202305,Mon Apr 08 03:53:37 +0000 2024,0,mjb emina di jsp,1777182987718910193,,megwumiw,in,Love Me Again,0,1,0,https://twitter.com/menjadimiauw/status/1777182987718910193,1265944578021974016,menjadimiauw,MJB Emina in JSP
1776979509620973947,Mon Apr 08 03:46:05 +0000 2024,0,emina liptint jaman sma sampe masih jatuh cinta,1777181091767673110,https://pbs.twimg.com/media/GKnQx-JaMAAxZde.jpg,ohmybeautybank,in,,0,0,0,https://twitter.com/Pocahontaz1997/status/1777181091767673110,1642467693453541376,Pocahontaz1997,Emina Liptint in high school until still falling in love
1776979509620973947,Mon Apr 08 03:44:19 +0000 2024,0,perliptintan suka emina feyrely emina feyrely,1777180646613619007,https://pbs.twimg.com/media/GKnQYBabYAAkPE6.jpg,ohmybeautybank,in,,0,0,0,https://twitter.com/Pocahontaz1997/status/1777180646613619007,1642467693453541376,Pocahontaz1997,Perliptikan likes Emina Feyrely Emina Feyrely
1777162019197825223,Mon Apr 08 03:37:51 +0000 2024,0,passes ela tiskovali bro neeku emina telusa,1777179021891309590,,taruNTaRock,in,,0,1,0,https://twitter.com/Tharun_2505/status/1777179021891309590,1513124485473669123,Tharun_2505,Passes Ela Tiskoval Bro Neku Emina Telusa
1777169588909936990,Mon Apr 08 03:00:22 +0000 2024,6,videos emina leak ayyaya maku share chesthe break istham,1777169588909936990,https://pbs.twimg.com/tweet_video_thumb/GKnGUTuWsAEw1nS.jpg,,in,BHARAT 🇮🇳,0,2,0,https://twitter.com/Mee_Rudra/status/1777169588909936990,964494988074627072,Mee_Rudra,Videos Emina Leak Ayyay Naku Share Chesthe Break Ishtam
1777165362146021840,Mon Apr 08 02:43:35 +0000 2024,0,bayata meetings emina pedtada sunstroke tagalataniki,1777165362146021840,,,in,Ekadooo,1,0,0,https://twitter.com/viratian_life/status/1777165362146021840,1094283672054890496,viratian_life,Bayata Meetings Emina Pedtada Sunstroke Tagsaniki
1776896656409305404,Mon Apr 08 02:38:44 +0000 2024,0,gak sih sebenernya udah tua suka lucu2 fungsional spotify bikin lucu gpp tetep shape nya spotify gitu warna ada hiasan2 nya gak spotify ujuk2 bola instagram kelinci ig tetep gambar kamera yang lucu bagus,1777164142778126792,,julysautumn,in,,0,0,0,https://twitter.com/EminaTheCat/status/1777164142778126792,1413755091471921162,EminaTheCat,"It's not actually old, it's already old, Spotify funny, making it funny, but the shape is spotify, so the color is not a decoration"
1777162849967862076,Mon Apr 08 02:33:36 +0000 2024,0,cocok emina,1777162849967862076,,,in,,0,0,0,https://twitter.com/altafrgy/status/1777162849967862076,1362610461267554308,altafrgy,Suitable Emina
1776978536223703183,Mon Apr 08 01:10:38 +0000 2024,0,emina lip balm wkwkwk,1777141971137818894,https://pbs.twimg.com/media/GKms6graMAA_Jnw.jpg,convomf,in,ur timeline,0,0,0,https://twitter.com/imlcathrn/status/1777141971137818894,1183192636401709056,imlcathrn,Emina Lip Balm Wkwkwk
1776997821532750042,Mon Apr 08 00:13:51 +0000 2024,0,emina bs yaa,1777127682763018493,,leopatrd,in,musèed♤,0,1,0,https://twitter.com/arinscity/status/1777127682763018493,1280061213523623936,arinscity,Emina BS
1777123260242813369,Sun Apr 07 23:56:17 +0000 2024,0,emina produk bagus gin warna doong,1777123260242813369,https://pbs.twimg.com/media/GKmcLl_bMAAF79H.jpg,,in,,0,0,0,https://twitter.com/notforent/status/1777123260242813369,1088403169871159296,notforent,Emina Good Gin Color product doong
1777104125349769676,Sun Apr 07 22:40:15 +0000 2024,0,udahlah mau beli emina glossy stain aja,1777104125349769676,,,in,,0,0,0,https://twitter.com/giyyew/status/1777104125349769676,1569938538225082368,giyyew,Already want to buy Emina Glossy Stain
1777076745856053677,Sun Apr 07 22:27:30 +0000 2024,0,fw emina bright stuff for acne porne ss skinaqua tutup tosca moist cerave sekarang gak pake bcs udah abis bingung beli,1777100919563538581,,ohmybeautybank,in,,0,0,0,https://twitter.com/desocian/status/1777100919563538581,1559871930064601088,desocian,FW Emina Bright Stuff for Acne Prone Skin Aqua CLOSE TOSCA MOIST CRAVE Now I don't use BCS already after being confused
1777079458387960235,Sun Apr 07 21:42:09 +0000 2024,0,lip scrub emina abis taun lip balm buttered spf 15nya,1777089506233176488,https://pbs.twimg.com/media/GKl9fQFbkAAJY6s.jpg,ohmybeautybank,in,Khayangan,0,0,0,https://twitter.com/mbaditaaa/status/1777089506233176488,1346080130,mbaditaaa,lip scrub emina after the taun lip balm butted spf 15
1777088495011705253,Sun Apr 07 21:38:08 +0000 2024,0,aseli muka gue kaya tolak banget produk emina knp yh,1777088495011705253,,,in,,0,0,0,https://twitter.com/apinbukankucing/status/1777088495011705253,1298452945336295426,apinbukankucing,"Aseli face, my face is very like the product of Emina KNP yh"
1776590997876519298,Sun Apr 07 20:13:41 +0000 2024,0,fking ignorant,1777067243181838685,,emina_c,in,"Dakota del Norte, USA",0,0,0,https://twitter.com/AlexxAIdresser/status/1777067243181838685,1759356252142931969,AlexxAIdresser,FKING IGNORANT
1776978536223703183,Sun Apr 07 19:44:00 +0000 2024,0,liptint emina glossy stain enak manis,1777059771117641913,,convomf,in,,0,0,0,https://twitter.com/jamalsupremacy_/status/1777059771117641913,1379092655880105987,jamalsupremacy_,liptint emina glossy stain delicious sweet
1776991404356784309,Sun Apr 07 19:39:04 +0000 2024,1,unduru gangavaram kotipalli thalapalam thamarapalii yarapothavaram inka emina kavala ra puka chpu,1777058529205260309,,prasannacherry,in,twitter ,0,0,0,https://twitter.com/AjayTentac40170/status/1777058529205260309,1650216510294740992,AjayTentac40170,Unduru Gangavaram Kotipalli Thalapalam Tharapalii Yarapothavaram Inka Emina Kavala RA Puka Chpu
1777057275116749034,Sun Apr 07 19:34:05 +0000 2024,0,master garu eppatinuncho waiting edho teaser vodhlutharu annaru ugadi ki emina chance untey oka post padeyandi swami,1777057275116749034,,MegaSuryaProd,in,"Andhra Pradesh, India",0,0,0,https://twitter.com/reddyvamsi61/status/1777057275116749034,892790449978482688,reddyvamsi61,Master Garu Eppatinunch Waiting Edho Teaser Vodhlutharu Annaru Ugadi Ki Emina Chance Untey Oka Post Padeyandi Swami
1777045351528095895,Sun Apr 07 18:46:42 +0000 2024,4,adhi ra maa ante emina ante ambani ani langalu lepkoni tho vastaru thanks for everything,1777045351528095895,,,in,Bengaluru,0,0,2,https://twitter.com/Vayu_18/status/1777045351528095895,802248337814593536,Vayu_18,Adhi RA Maa Ante Emina Ante Ambani Ani Langalu Lepkoni Tho Vastaru Thanks for Everything
1777044342294904924,Sun Apr 07 18:42:41 +0000 2024,0,rekomendasiin sunscreen spf 35 serta linknya azarine the originote emina wardah biore bioaqua,1777044342294904924,https://pbs.twimg.com/ext_tw_video_thumb/1777044280303026176/pu/img/6uqV4jBwi-6JPuf5.jpg,,in,,0,1,0,https://twitter.com/noyiw97/status/1777044342294904924,1716708071270232064,noyiw97,Recommendation Sunscreen SPF 35 and the link is Azarine the originote Emina Wardah Biore Bioaqua
1777044074668957967,Sun Apr 07 18:41:37 +0000 2024,1,families ki nachutundi antunnaru entra mu emina orphans ha ra idem rotta marketing ra,1777044074668957967,,,in,,0,0,0,https://twitter.com/nih__8/status/1777044074668957967,1726187449402159104,nih__8,Families Ki Nachutundi Antunnaru Entra Mu Emina Orphans Ha Ra Idem Rotta Marketing RA
1776958620883935453,Sun Apr 07 18:18:24 +0000 2024,0,avi emina puku lo aathula bro,1777038231747674218,,jsvasu,in,,0,1,0,https://twitter.com/Naiduganty17838/status/1777038231747674218,1759279552608780288,Naiduganty17838,Avi Emina Puku Lo Aathula bro
1777030653311418583,Sun Apr 07 17:48:18 +0000 2024,0,repliesnya bilang emina hanasui gue akuin emang manis apa iya ngestain not cipok related tp di gue cepet ambyar,1777030653311418583,,,in,minor & homophobic dnf.,0,0,0,https://twitter.com/athlaentic/status/1777030653311418583,1740174498283008000,athlaentic,"The replies say that Emina Hanasui I admit that it is sweet, yes, right?"
1777029612910071986,Sun Apr 07 17:44:09 +0000 2024,1,aina 164 defend cheyakunda undadaniki mu emina rcb anukunnarentra,1777029612910071986,https://pbs.twimg.com/media/GKlHBAnbEAAngHE.jpg,,in,,0,0,1,https://twitter.com/klrahulbanisa/status/1777029612910071986,1405828203600498699,klrahulbanisa,AINA 164 Defend Cheyakunda Undadaniki Mu Emina RCB Anukunnarentra
1777029297259368904,Sun Apr 07 17:42:54 +0000 2024,20,konni days nunchi edo thedaga undhi body lo emina ayithadii emo bayam dengutundi,1777029297259368904,https://pbs.twimg.com/ext_tw_video_thumb/1775815108481916928/pu/img/gxY5olbtEMMbhVXT.jpg,,in,palanadu 🦁,1,5,2,https://twitter.com/animeReddy12/status/1777029297259368904,1600470622974357504,animeReddy12,Konni Days Nunchi Edo Thedaga Undhi Body Lo Emina Ayithadii Emo Dinas Dengutundundi
1776978536223703183,Sun Apr 07 17:33:23 +0000 2024,0,emina glossy stain stainnya mantep aroma rasa manis manis semangka gituchuuu saran shade cakeup 01 autumn bell 07 french vanilla,1777026900344655905,,convomf,in,,0,1,0,https://twitter.com/hkhaira_/status/1777026900344655905,981069479399403520,hkhaira_,"Emina Glossy Stain Stain the aroma of sweet sweet taste in the watermelon, the advice of shade cakeup 01 autumn bell 07 french vanilla"
1775882761280356698,Sun Apr 07 17:26:01 +0000 2024,0,anjay syukur yah emina ramah kantong ajar,1777025046101569672,,gangsciele,in,He/Him. Games. AR 60. TL 67.,0,0,0,https://twitter.com/saktii/status/1777025046101569672,1583455060297515008,saktii,"Anjay Gratitude, Emina, teaching pocket friendly"
1777022878975950899,Sun Apr 07 17:17:24 +0000 2024,0,ee year inka job radhemo naku earnings 2 spending8 emina nyayama swamy neeku idhi,1777022878975950899,,,in,"Vijayawada, India",0,0,0,https://twitter.com/MNJTweeets/status/1777022878975950899,766152777643024384,MNJTweeets,Ee Year Inka Job Radhemo Naku Earnings 2 Spending8 Emina Nyayama Swamy Neku Idhi
1776980767790498017,Sun Apr 07 17:02:11 +0000 2024,0,emina klo low budget ak totolin jerawat hari langsung kering dn hempas hari kwmudian,1777019050729865672,,ohmybeautybank,in, klo mau beli wassap aja 👇,0,0,0,https://twitter.com/bubllegm/status/1777019050729865672,1294386436829929472,bubllegm,Emina if low budget ak totolin pimples day immediately dry and live day
1776952671255290047,Sun Apr 07 16:58:24 +0000 2024,2,alaga ayethe happy ne ayyaemina maku rod padindhi we expect industry hitinthake neku ala telusu pan india ki reserve chesaru ani script,1777018096915718200,,YASHWANTH1411,in,,0,1,0,https://twitter.com/urstrulysanju7/status/1777018096915718200,1567034102620254209,urstrulysanju7,ALAGA AYETHE HAPPY NE AYYAEMINA MAKU ROD PADINDHI WE EXPECT INDUSTRY HITINTHAKE NEKU ALA TELUSU PAN INDIA KI RESERVE CERSARU ANI SCRIPT
1777017703389392903,Sun Apr 07 16:56:50 +0000 2024,2,emayya dilraju e uppal balu laga uppal aathul celebrations ani emina tag kothadi creat cheyochuga,1777017703389392903,https://pbs.twimg.com/media/GKk8LuLW8AMG-UT.jpg,,in,United Kingdom,0,0,2,https://twitter.com/GaniTweets19/status/1777017703389392903,1319150841006182400,GaniTweets19,Emayya dilated e Uppal Balu Uppal Aathul Celebtesions Ani Emina Tag Kothadi Creat Cheyochuga
1777011768306602124,Sun Apr 07 16:40:40 +0000 2024,1,gak tau gue gpke emina,1777013635447153141,,KH0507NAW,in,nctzen,0,1,0,https://twitter.com/haechuuuy/status/1777013635447153141,1752964563199479809,haechuuuy,"I don't know, I don't know Emina"
1777008545155932649,Sun Apr 07 16:33:39 +0000 2024,0,jarang pake micellar water balik pake facial wash emina bersih bangett gak ninggal jejak,1777011868537917676,,ohmybeautybank,in,,0,1,0,https://twitter.com/meetonfriday/status/1777011868537917676,233071159,meetonfriday,"rarely use micellar water back using facial wash Emina is very clean, it doesn't leave a trail"
1777011768306602124,Sun Apr 07 16:33:15 +0000 2024,0,eh emina gloss stain emang bau nangka kh pas gak abis makan nangka sii,1777011768306602124,,,in,,0,1,0,https://twitter.com/KH0507NAW/status/1777011768306602124,1635936081827840000,KH0507NAW,"Eh Emin Gloss stain, it smells of jackfruit when I don't finish eating jackfruit sii"
1776978536223703183,Sun Apr 07 16:22:29 +0000 2024,1,hanasui lip tint emina glossy stain enak tu manis,1777009060501741800,,convomf,in,,0,0,0,https://twitter.com/bnnamiilk/status/1777009060501741800,1496765071493455880,bnnamiilk,Hanasui Lip Tint Emina Glossy Stain Delicious
1777005065884348540,Sun Apr 07 16:09:26 +0000 2024,0,kalo per 2 full face masker 1 hari di spot acne aja lanjut pake spot gel ajaa works banget jerawat mendem ngeringin stop make up duluuu masker himalaya spot gel emina,1777005773635358782,,ohmybeautybank,in,,0,1,0,https://twitter.com/ayezulaa/status/1777005773635358782,1705606621307809792,ayezulaa,"If per 2 full face mask 1 day at the acne spot, just continue using a gel spot, just acne really want to stop the make up first."
1777000850533360007,Sun Apr 07 15:49:52 +0000 2024,0,tau mana muka gua disodorin scarlett emina wardah the originote gamau mau cosrx bjiirrr boncos,1777000850533360007,,,in,nadoong,0,0,0,https://twitter.com/yonaanaa/status/1777000850533360007,1269489401207255040,yonaanaa,Know where my face was disodorin Scarlett Emina Wardah The Originote Gamau Want Cosrx Bjjirrr Boncos
1776949639331348595,Sun Apr 07 15:45:45 +0000 2024,0,kalo powder blush pake emina cher bloss cakep banget cool tonenya udah discontinue,1776999815320326391,,bellluea,in,17,0,0,0,https://twitter.com/bellluea/status/1776999815320326391,1742399692389191680,bellluea,if powder blush using Emina Cher Bloss is really handsome
1776997821532750042,Sun Apr 07 15:39:54 +0000 2024,0,eh gak deng emina gak zionist maybelline doang,1776998342729576463,,leopatrd,in,,0,0,0,https://twitter.com/leopatrd/status/1776998342729576463,1343451708815331328,leopatrd,"Eh, I didn't listen to Emina, not a zionist maybelline"
1776997821532750042,Sun Apr 07 15:37:50 +0000 2024,0,meybelline emina zionist anjir untung gak sempet beli produk ny,1776997821532750042,,,in,,0,3,0,https://twitter.com/leopatrd/status/1776997821532750042,1343451708815331328,leopatrd,Maybelline Emina Zionist Anjir fortunately didn't have time to buy the product
1776996623564112320,Sun Apr 07 15:33:04 +0000 2024,0,ini look kalo pake moist ss primer loose powder emina jujur pede dark spot gak tutup jadiii ada saran gak saran gpp deh curhat aja kesel soalny kek org org cakep banget make up muka halus,1776996623564112320,https://pbs.twimg.com/media/GKkpAWUbUAAv4qE.jpg,,in,Tangerang ,0,1,0,https://twitter.com/divvymm/status/1776996623564112320,1574570543604387840,divvymm,this look if you use moist ss primer loose powder emina honestly dark spot not closed so there are suggestions not advice gpp just confide in the problem
1776993362274668962,Sun Apr 07 15:31:28 +0000 2024,0,yaaa kl ss masih exploring tt cm kemarin sempet pake facetology emina sun battle cica lumayan bagus aku acne prone cm si facetology cepet banget abis jir,1776996218625040855,,gominsi5xy,in,,0,2,0,https://twitter.com/minnie7xy/status/1776996218625040855,1761817693324505088,minnie7xy,yaaa kl ss still exploring tt cm yesterday I used to use facetology Emina Sun Battle Cica pretty good I acne prone cm the facetology really fast after jir
1776989460435202305,Sun Apr 07 15:24:36 +0000 2024,27,keinget emina tapi sptinya menarikk,1776994489913274490,,literarybase,in,Bumi,0,2,0,https://twitter.com/megwumiw/status/1776994489913274490,1734752954782306304,megwumiw,Emina's keinget but it seems interesting
1776982846844096794,Sun Apr 07 15:20:14 +0000 2024,2,money teesukoni work chesthe papam ela anta neeku papam kavachu adik profession jagan emina anachu prasant kishor ni ante mamulga undadhu,1776993394218369356,,ates4444v,in,,0,2,0,https://twitter.com/Namasthepeople/status/1776993394218369356,1731610728782815232,Namasthepeople,Money Teesukoni Work Chesthe Papam Ela Anta Neku Papam Kavachu Sister Profession Jagan Emina Anachu Prasant Kishor Ni Ante Mamulga Undadhu
1776745227249983703,Sun Apr 07 12:54:29 +0000 2024,2,pake sebamed sih buttered aja kalo dibandingin lipbalm produk pelembab bibir pernah aku pake urut kek gin 1 nivea biru 2 buttered 3 emina balm jar amp lip sleeping mask 4 lano salve 5 himalaya 6 nivea putih yang ada spfnya 7 lip ice,1776956714136613308,,ohmybeautybank,in,,0,1,0,https://twitter.com/schweetboba/status/1776956714136613308,921732456310497281,schweetboba,"use sebamed, but only if compared to lipbalm lip moisturizing products I have used sorted KEK GIN 1 NIVEA BLUE 2 BUTTERED 3 EMINA BALM JAR AMP LIP SLEEPING MASK 4 LANO SALVE 5 HIMALAYA 6 NIVEA White which has 7 SPF Lip Ice"
1776955558979158342,Sun Apr 07 12:49:54 +0000 2024,0,top tier lip tintku tetep emina glossy stain sihhh udah pake jaman kuliah knp jarang yang ngomonngin pdhl bagusss,1776955558979158342,,,in,,0,0,0,https://twitter.com/gstgstt/status/1776955558979158342,269819172,gstgstt,Top Tier Lip Tint I still Emina Glossy Stain already uses college era why rarely people who talk to PDHL Bagusss
1776942771515109426,Sun Apr 07 12:38:20 +0000 2024,0,klo oily mending invest the primer loose powder gak pakai setting spray aman pagi malem alam pribadi pakai primer studio tropik loose powder emina kadang klo gak loose powder pakai twc wardah,1776952648849363385,,ohmybeautybank,in,keeping this as sbt account ,0,1,0,https://twitter.com/renmintjun/status/1776952648849363385,1538530984697602048,renmintjun,"If Oily, it's better to invest in the primer loose powder not to use the safe spray settings in the morning, the primary primer of the emina tropical powder is sometimes if you don't loose the powder using the wardah twc wardah"
1776557665335849394,Sun Apr 07 12:32:54 +0000 2024,0,try emina lip mask and scrub macam dupe laneige sleeping mask bibir i dulu gelap and belah tapi lepas istiqamah pakai malam tidur jadi heheh cubalah try,1776951280281542721,,flowernym,in,,0,0,0,https://twitter.com/doublerockspin_/status/1776951280281542721,1188009339488886784,doublerockspin_,Try Emina lip mask and scrub like dupe laneige sleeping mask lip i used to be dark and split but let go of istiqamah using night sleep so heheh try try
1776595389216391180,Sun Apr 07 12:08:34 +0000 2024,0,cleanser cleansing creamnya viva fw himalaya toner autumn centella serum gak pake essence gak pake moist g2g centella spf ss emina obat jerawat viva acne gel viva acne lotion emina pimple mediklin pling bgus face mask neem mask himalaya anti aging,1776945159131050224,,tanyarlfes,in,,0,1,0,https://twitter.com/siCutiePie/status/1776945159131050224,1189287249378074624,siCutiePie,Cleanser Cleansing Cream Viva FW Himalayan Toner Autumn Centella Serum does not use Essence not using moist G2G Centella spf ss Emina pimples Viva Acne Gel Viva Acne Acne Lotion Emina Mediclin Mediclin Pling Bgus Face Mask Mask Neem Mask Neem Mask Himalaya Anti -Aging
1776942771515109426,Sun Apr 07 12:03:15 +0000 2024,0,dapat itu loose powder emina setting spray hanasui,1776943819042472270,,ohmybeautybank,in,yk,0,0,0,https://twitter.com/sudutmemori/status/1776943819042472270,1297015618856554496,sudutmemori,can be loose powder emina setting spray hanasui
1776942771515109426,Sun Apr 07 12:02:17 +0000 2024,0,dapet dua2nya sih oily pake loose powder emina daily matte setting spray kayak pixy di harga 30 an,1776943578058723779,,ohmybeautybank,in,she / her | legal,0,0,0,https://twitter.com/samudriartha/status/1776943578058723779,1279388018684555264,samudriartha,get two of the oily using loose powder Emina Daily Matte Settings spray like Pixy at the price of 30
1776906808784732590,Sun Apr 07 11:52:17 +0000 2024,0,pernahh itu pas malang adem aku pas gak bawa jaket pakein jaket aku huhuhu gentleman banget kita gak jadi but he still a good friend,1776941058880090516,,tanyarlfes,in,,0,0,0,https://twitter.com/EminaTheCat/status/1776941058880090516,1413755091471921162,EminaTheCat,"I once was poor when I was cool when I didn't carry a jacket using a jacket, I really huhuhu gentleman we didn't become a good friend"
1776940530704044466,Sun Apr 07 11:50:11 +0000 2024,0,mending blush on emina wardah,1776940530704044466,,,in,,0,3,0,https://twitter.com/zenniemie/status/1776940530704044466,1679120102422380544,zenniemie,Better Blush on Emina Wardah
1776936358260396074,Sun Apr 07 11:46:19 +0000 2024,0,shade yang emina plis,1776939558019715091,,cantiixk,in,vale,0,1,0,https://twitter.com/donlifmi/status/1776939558019715091,1538805142900084736,donlifmi,shade the emina plis
1776939450431680908,Sun Apr 07 11:45:53 +0000 2024,0,abis beli azarine nyata texturenya kek lip cream gitu dahhh besok ke emina aja,1776939450431680908,https://pbs.twimg.com/media/GKj1Ai5bEAAwY-Z.jpg,,in,wonderland,0,0,0,https://twitter.com/princeddalgi/status/1776939450431680908,798025448,princeddalgi,after buying azarine real texture kek lip cream like that tomorrow to Emina
1776936358260396074,Sun Apr 07 11:34:40 +0000 2024,0,emina lu foto nya gak kl swatch plis gue butuh refrensi lip merah,1776936625546858936,,cantiixk,in,vale,0,1,0,https://twitter.com/donlifmi/status/1776936625546858936,1538805142900084736,donlifmi,"Emina You don't take a photo, I don't need a red lip reference"
1776933216861008249,Sun Apr 07 11:21:07 +0000 2024,0,sugar rush emina makan gasih manis banget bjirrr yang makan,1776933216861008249,,,in,,0,0,0,https://twitter.com/0725JJANG/status/1776933216861008249,1610121460101808129,0725JJANG,Sugar Rush Emina eating isn't really sweet who eats
1776893028848058580,Sun Apr 07 11:12:01 +0000 2024,2,neku emina kallu dengay ra chetta langa kodaka,1776930927743996181,,PKadmirer03,in,,0,0,0,https://twitter.com/Varunjayker/status/1776930927743996181,1759452318385557504,Varunjayker,Neku Emina Kallu with Ra Chetta Langa Kodaka
1776930251395960923,Sun Apr 07 11:09:20 +0000 2024,0,udah bulan coba pake loose powder emina bright stuff sadar serbuk bedak serbuk bling bling wangi tiap dipake,1776930251395960923,,,in,🇮🇩,0,0,0,https://twitter.com/neomubitchy/status/1776930251395960923,729765631298441216,neomubitchy,Already Month Try Using Loose Powder Emina Bright Stuff Aware of Powder Powder Bling Bling Bling Powder Every Pedy
1776923062115459157,Sun Apr 07 10:40:46 +0000 2024,16,ma hitman emina chokli anukaru antra 120 sr adanu,1776923062115459157,https://pbs.twimg.com/media/GKjmG1pXsAAx_SR.jpg,,in,,0,0,4,https://twitter.com/mohanpkntr/status/1776923062115459157,1551879954383912960,mohanpkntr,Ma Hitman Emina Chokli Anukaru Antra 120 SR Adanu
1776910501567496593,Sun Apr 07 10:32:23 +0000 2024,0,gak pek,1776920954100236495,,tanyakanrl,in,,0,0,0,https://twitter.com/EminaTheCat/status/1776920954100236495,1413755091471921162,EminaTheCat,No Pek
1776916656616575434,Sun Apr 07 10:15:19 +0000 2024,1,ill try this mau beli emina browcara mau beli mascaranya browcaranya tadi nyoba browcara merk nyata aku yang ngga pakenya nyata ada ini yang bisa dipake alis bulu mata hematt,1776916656616575434,https://pbs.twimg.com/media/GKjgSELakAE2IZ2.jpg,,in,,0,0,0,https://twitter.com/buttxrfly28/status/1776916656616575434,1089456176251600897,buttxrfly28,"Ill try this, I want to buy Emina Browa want to buy the masc. Her brow she tried the real brand of my brand who didn't use it, there was this one that could be used with Hematt eyelashes eyebrows"
1776905150403088576,Sun Apr 07 10:09:05 +0000 2024,0,omg nder belum pake emina ngerasa cocokcocok aja pas beli udah refirmula ngerasa kusem wajah kayak oily bingung ganti wardah tosca omg ada promo omg pilih surprisingly cocok,1776915088236069236,,ohmybeautybank,in,,0,1,0,https://twitter.com/KyrenaLhrastsha/status/1776915088236069236,1714593827410120704,KyrenaLhrastsha,omg nder hasn't used Emina to feel suitable just right when you buy it already refirmed that I feel like a face like an oily confused changing wardah tosca omg there is a promo omg selecting surprisely suitable
